[
  {
    "id": "pll-ua",
    "name": "Ua Perm",
    "method": "cfop",
    "stage": "pll",
    "category": "edges-only",
    "difficulty": 2,
    "algorithms": [
      {
        "notation": "R U' R U R U R U' R' U' R2",
        "moves": [
          {
            "base": "R",
            "modifier": "",
            "notation": "R"
          },
          {
            "base": "U",
            "modifier": "'",
            "notation": "U'"
          },
          {
            "base": "R",
            "modifier": "",
            "notation": "R"
          },
          {
            "base": "U",
            "modifier": "",
            "notation": "U"
          },
          {
            "base": "R",
            "modifier": "",
            "notation": "R"
          },
          {
            "base": "U",
            "modifier": "",
            "notation": "U"
          },
          {
            "base": "R",
            "modifier": "",
            "notation": "R"
          },
          {
            "base": "U",
            "modifier": "'",
            "notation": "U'"
          },
          {
            "base": "R",
            "modifier": "'",
            "notation": "R'"
          },
          {
            "base": "U",
            "modifier": "'",
            "notation": "U'"
          },
          {
            "base": "R",
            "modifier": "2",
            "notation": "R2"
          }
        ],
        "source": "SpeedCubeDB",
        "recommended": true
      }
    ],
    "recognitionHints": [
      "Three edges need to cycle",
      "One edge already solved"
    ],
    "probability": 0.0476
  },
  {
    "id": "pll-ub",
    "name": "Ub Perm",
    "method": "cfop",
    "stage": "pll",
    "category": "edges-only",
    "difficulty": 2,
    "algorithms": [
      {
        "notation": "R2 U R U R' U' R' U' R' U R'",
        "moves": [
          {
            "base": "R",
            "modifier": "2",
            "notation": "R2"
          },
          {
            "base": "U",
            "modifier": "",
            "notation": "U"
          },
          {
            "base": "R",
            "modifier": "",
            "notation": "R"
          },
          {
            "base": "U",
            "modifier": "",
            "notation": "U"
          },
          {
            "base": "R",
            "modifier": "'",
            "notation": "R'"
          },
          {
            "base": "U",
            "modifier": "'",
            "notation": "U'"
          },
          {
            "base": "R",
            "modifier": "'",
            "notation": "R'"
          },
          {
            "base": "U",
            "modifier": "'",
            "notation": "U'"
          },
          {
            "base": "R",
            "modifier": "'",
            "notation": "R'"
          },
          {
            "base": "U",
            "modifier": "",
            "notation": "U"
          },
          {
            "base": "R",
            "modifier": "'",
            "notation": "R'"
          }
        ],
        "source": "SpeedCubeDB",
        "recommended": true
      }
    ],
    "recognitionHints": [
      "Three edges need to cycle",
      "Mirror of Ua"
    ],
    "probability": 0.0476
  },
  {
    "id": "pll-h",
    "name": "H Perm",
    "method": "cfop",
    "stage": "pll",
    "category": "edges-only",
    "difficulty": 2,
    "algorithms": [
      {
        "notation": "M2 U M2 U2 M2 U M2",
        "moves": [
          {
            "base": "M",
            "modifier": "2",
            "notation": "M2"
          },
          {
            "base": "U",
            "modifier": "",
            "notation": "U"
          },
          {
            "base": "M",
            "modifier": "2",
            "notation": "M2"
          },
          {
            "base": "U",
            "modifier": "2",
            "notation": "U2"
          },
          {
            "base": "M",
            "modifier": "2",
            "notation": "M2"
          },
          {
            "base": "U",
            "modifier": "",
            "notation": "U"
          },
          {
            "base": "M",
            "modifier": "2",
            "notation": "M2"
          }
        ],
        "source": "SpeedCubeDB",
        "recommended": true
      }
    ],
    "recognitionHints": [
      "All four edges swapped",
      "Two opposite edge swaps"
    ],
    "probability": 0.0238
  },
  {
    "id": "pll-z",
    "name": "Z Perm",
    "method": "cfop",
    "stage": "pll",
    "category": "edges-only",
    "difficulty": 3,
    "algorithms": [
      {
        "notation": "M' U M2 U M2 U M' U2 M2",
        "moves": [
          {
            "base": "M",
            "modifier": "'",
            "notation": "M'"
          },
          {
            "base": "U",
            "modifier": "",
            "notation": "U"
          },
          {
            "base": "M",
            "modifier": "2",
            "notation": "M2"
          },
          {
            "base": "U",
            "modifier": "",
            "notation": "U"
          },
          {
            "base": "M",
            "modifier": "2",
            "notation": "M2"
          },
          {
            "base": "U",
            "modifier": "",
            "notation": "U"
          },
          {
            "base": "M",
            "modifier": "'",
            "notation": "M'"
          },
          {
            "base": "U",
            "modifier": "2",
            "notation": "U2"
          },
          {
            "base": "M",
            "modifier": "2",
            "notation": "M2"
          }
        ],
        "source": "SpeedCubeDB",
        "recommended": true
      }
    ],
    "recognitionHints": [
      "Diagonal edge swap",
      "Headlights on opposite sides"
    ],
    "probability": 0.0238
  },
  {
    "id": "pll-aa",
    "name": "Aa Perm",
    "method": "cfop",
    "stage": "pll",
    "category": "corners-only",
    "difficulty": 3,
    "algorithms": [
      {
        "notation": "x R' U R' D2 R U' R' D2 R2 x'",
        "moves": [
          {
            "base": "x",
            "modifier": "",
            "notation": "x"
          },
          {
            "base": "R",
            "modifier": "'",
            "notation": "R'"
          },
          {
            "base": "U",
            "modifier": "",
            "notation": "U"
          },
          {
            "base": "R",
            "modifier": "'",
            "notation": "R'"
          },
          {
            "base": "D",
            "modifier": "2",
            "notation": "D2"
          },
          {
            "base": "R",
            "modifier": "",
            "notation": "R"
          },
          {
            "base": "U",
            "modifier": "'",
            "notation": "U'"
          },
          {
            "base": "R",
            "modifier": "'",
            "notation": "R'"
          },
          {
            "base": "D",
            "modifier": "2",
            "notation": "D2"
          },
          {
            "base": "R",
            "modifier": "2",
            "notation": "R2"
          },
          {
            "base": "x",
            "modifier": "'",
            "notation": "x'"
          }
        ],
        "source": "SpeedCubeDB",
        "recommended": true
      }
    ],
    "recognitionHints": [
      "Three corners cycle",
      "Headlights on left"
    ],
    "probability": 0.0476
  },
  {
    "id": "pll-ab",
    "name": "Ab Perm",
    "method": "cfop",
    "stage": "pll",
    "category": "corners-only",
    "difficulty": 3,
    "algorithms": [
      {
        "notation": "x R2 D2 R U R' D2 R U' R x'",
        "moves": [
          {
            "base": "x",
            "modifier": "",
            "notation": "x"
          },
          {
            "base": "R",
            "modifier": "2",
            "notation": "R2"
          },
          {
            "base": "D",
            "modifier": "2",
            "notation": "D2"
          },
          {
            "base": "R",
            "modifier": "",
            "notation": "R"
          },
          {
            "base": "U",
            "modifier": "",
            "notation": "U"
          },
          {
            "base": "R",
            "modifier": "'",
            "notation": "R'"
          },
          {
            "base": "D",
            "modifier": "2",
            "notation": "D2"
          },
          {
            "base": "R",
            "modifier": "",
            "notation": "R"
          },
          {
            "base": "U",
            "modifier": "'",
            "notation": "U'"
          },
          {
            "base": "R",
            "modifier": "",
            "notation": "R"
          },
          {
            "base": "x",
            "modifier": "'",
            "notation": "x'"
          }
        ],
        "source": "SpeedCubeDB",
        "recommended": true
      }
    ],
    "recognitionHints": [
      "Three corners cycle",
      "Headlights on right"
    ],
    "probability": 0.0476
  },
  {
    "id": "pll-e",
    "name": "E Perm",
    "method": "cfop",
    "stage": "pll",
    "category": "corners-only",
    "difficulty": 4,
    "algorithms": [
      {
        "notation": "x' R U' R' D R U R' D' R U R' D R U' R' D' x",
        "moves": [
          {
            "base": "x",
            "modifier": "'",
            "notation": "x'"
          },
          {
            "base": "R",
            "modifier": "",
            "notation": "R"
          },
          {
            "base": "U",
            "modifier": "'",
            "notation": "U'"
          },
          {
            "base": "R",
            "modifier": "'",
            "notation": "R'"
          },
          {
            "base": "D",
            "modifier": "",
            "notation": "D"
          },
          {
            "base": "R",
            "modifier": "",